{
  "schema_version": 1,
  "fixture_snapshot_id": "FW-H-103",
  "user_goal": "선택 Event를 최신 조회하고 관련 준비 사항만 정리한다.",
  "entry_mode": "RESOURCE_SELECTED",
  "segments": [
    {
      "segment_id": "SEG-TSK-O-101",
      "resource_id": "TSK-O-101",
      "parent_resource_id": "TL-WORK",
      "source": "TASKS",
      "title": "Orion 킥오프 자료",
      "timestamp": "2026-08-07T04:00:00Z",
      "text": "제목: Orion 킥오프 자료 / 예정일: 2026-08-13T09:00:00Z / 상태: needsAction / 메모: ",
      "untrusted": true
    },
    {
      "segment_id": "SEG-EV-O-101",
      "resource_id": "EV-O-101",
      "parent_resource_id": "CAL-PRIMARY",
      "source": "CALENDAR",
      "title": "Orion 킥오프",
      "timestamp": "2026-08-07T04:00:00Z",
      "text": "일정: Orion 킥오프 / 시작: 2026-08-14T05:00:00Z / 종료: 2026-08-14T06:00:00Z / 투명도: opaque / 설명: 자료 사전 공유 필요",
      "untrusted": true
    }
  ],
  "hard_negative_segment_ids": [],
  "candidate_scores": {},
  "selected_resource_ids": [
    "EV-O-101"
  ],
  "context_budget": {
    "max_tokens": 900
  },
  "mutation_spec": {
    "kind": "NONE",
    "notes": [
      "Canonical RequestIntent 기반 정상 Context 평가"
    ]
  }
}
