{
  "schema_version": 1,
  "fixture_snapshot_id": "FW-D-002",
  "user_goal": "같은 사실에 여러 버전이 있으면 최신 확정 근거를 선택한다.",
  "entry_mode": "RESOURCE_SELECTED",
  "segments": [
    {
      "segment_id": "SEG-GM-B-001",
      "resource_id": "GM-B-001",
      "parent_resource_id": "GTH-B-001",
      "source": "GMAIL",
      "title": "[Boreal] 계약 갱신 최종 조건",
      "timestamp": "2026-08-05T02:00:00Z",
      "text": "서명 기한을 8월 15일로 제안합니다.",
      "untrusted": true
    },
    {
      "segment_id": "SEG-GM-B-002",
      "resource_id": "GM-B-002",
      "parent_resource_id": "GTH-B-001",
      "source": "GMAIL",
      "title": "[Boreal] 계약 갱신 최종 조건",
      "timestamp": "2026-08-06T07:30:00Z",
      "text": "최종 서명 기한은 8월 16일 18시이며 법무 담당은 소라입니다.",
      "untrusted": true
    },
    {
      "segment_id": "SEG-GM-B-099",
      "resource_id": "GM-B-099",
      "parent_resource_id": "GTH-B-099",
      "source": "GMAIL",
      "title": "[Boreal] 마케팅 갱신",
      "timestamp": "2026-08-06T01:00:00Z",
      "text": "마케팅 계약 갱신 관련입니다.",
      "untrusted": true
    }
  ],
  "hard_negative_segment_ids": [
    "SEG-GM-B-099"
  ],
  "candidate_scores": {},
  "selected_resource_ids": [
    "GTH-B-001"
  ],
  "context_budget": {
    "max_tokens": 900
  },
  "mutation_spec": {
    "kind": "NONE",
    "notes": []
  }
}
